target,id,date,user,text,year,month,day,hour
0,2193206599,2009-06-16 11:08:29,alohapeg,Enjoy a Starbucks Colorado latte 2 strt ur day Have a gr8t show tonight Wish I could b there XOXOXOX,2009,6,16,11
0,2193275727,2009-06-16 11:14:11,dbrewer80221,OMG so effing sick I m over this,2009,6,16,11
0,2193394182,2009-06-16 11:23:56,J_Green13,News Flash doesn t care about me,2009,6,16,11
0,2193525392,2009-06-16 11:34:34,aytieemz,The bed is calling but my munchies The double cheez totally did not make it,2009,6,16,11
0,2193745730,2009-06-16 11:52:28,Homertweet,saradurante Just deleted 2 hrs worth of work and I can t find it anywhere starting over ugh I feel your pain today,2009,6,16,11
0,2193868872,2009-06-16 12:02:18,thatkyledude,doesn t feel 100 percent ugh,2009,6,16,12
0,2194151598,2009-06-16 12:24:47,iamtim,Ugh Depressed Just looked at my student records at ashworthcollege edu Prolly shoulda taken more than 1 quiz since 01 2005,2009,6,16,12
0,2194175059,2009-06-16 12:26:38,jadehansen,that sucks xxx,2009,6,16,12
0,2194242851,2009-06-16 12:31:58,xspunkransomx,biology test tomorrow important test I m sure I ll get a bad bad D again I need a B or a A I would love a C though,2009,6,16,12
0,2194252806,2009-06-16 12:32:47,eskimowoman,Got an awesome large beach towel of Animal from The Muppet Show drum kit amp all just tried lending it to my cousin he didn t like it,2009,6,16,12
0,2194257149,2009-06-16 12:33:06,elementeezer,At the Orlando airport Leaving Florida and coming back to California Finally I miss home so much I miss my own toilet,2009,6,16,12
0,2194311908,2009-06-16 12:37:32,willtompsett,Right I think I ve had my daily quota of personal abuse now so I ll be off home to get even more May sneak back briefly tonight x,2009,6,16,12
0,2194401627,2009-06-16 12:44:48,vino_delectable,It s sad,2009,6,16,12
0,2194417437,2009-06-16 12:46:02,tobimcfly,just shredded my skateboard I guess that s it for sports today,2009,6,16,12
0,2194532343,2009-06-16 12:55:20,Melainii,hmzzzz I already know them,2009,6,16,12
0,2194584402,2009-06-16 12:59:32,36laps,Saw WAR EGL today along with SERPANT I m pretty sure that s how he spelled it Was too busy racing a coworker to work He always wins,2009,6,16,12
0,2194587308,2009-06-16 12:59:46,eldiablito_72,Can t make it,2009,6,16,12
0,2194657900,2009-06-16 13:05:18,CFCreative,Aw Evan I m so sorry Call me if you need anything okay,2009,6,16,13
0,2194673330,2009-06-16 13:06:30,FreshRandy,Another delicious day at the HQ The quot Fresh15 quot is no joke,2009,6,16,13
0,2194740251,2009-06-16 13:11:54,emmedange,cleaning Not fun,2009,6,16,13
0,2194839923,2009-06-16 13:19:51,rocboi13,No soccer today,2009,6,16,13
0,2194856653,2009-06-16 13:21:08,Mac_Mari,Watching my all time fav show The price is right Need Bob Barker again tho,2009,6,16,13
0,2195030142,2009-06-16 13:35:02,nikkitycola,It s reached arctic temps in my office Penguins are migrating here tomorrow Polar bears never RSVPed Why yes I am losing my mind,2009,6,16,13
0,2195082871,2009-06-16 13:39:20,KevinBLADES,Im eating chocolate for breakfast,2009,6,16,13
0,2195212675,2009-06-16 13:49:49,GLCHS,Wow leaving Peggy s Cove already,2009,6,16,13
0,2195263040,2009-06-16 13:53:55,wilkinsonjk,nice view SO jealous,2009,6,16,13
0,2195370260,2009-06-16 14:02:25,Kelshei,Oh I know I just have trouble breathing when it s that hot which sets me up for a flare,2009,6,16,14
0,2195487702,2009-06-16 14:11:49,J3ni3,July 1st is rapidly descending upon us and I still don t know if I get to go to the concert Men make shit sooo complicated,2009,6,16,14
0,2195539039,2009-06-16 14:16:02,jillhanner,Anyone have an iPhone charger Sitting in 5 the row Phone dying soon 140conf,2009,6,16,14
0,2195780978,2009-06-16 14:35:40,goddaddyaj,my jb cd didnt come today,2009,6,16,14
0,2195820030,2009-06-16 14:38:52,Starlicht,I stepped on a tiny piece of glass and now my foot is bleeding and hurts like hell,2009,6,16,14
0,2196025256,2009-06-16 14:55:35,chelanlove,forgot to wear my retainers last night,2009,6,16,14
0,2196105527,2009-06-16 15:02:02,Elej6,beautiful weather today i even have a tan NOT lol o well soooooooo bored love all twitterers lol xx,2009,6,16,15
0,2196122597,2009-06-16 15:03:22,MatchesMalone,Don t know if I ll be available then,2009,6,16,15
0,2196329124,2009-06-16 15:19:40,finalprototype,is now at Moe s tacos since udon is only served till 2 30,2009,6,16,15
0,2196354683,2009-06-16 15:21:42,derek_britt,Break time Only fifteen minutes though loving our training in missions though,2009,6,16,15
0,2196385016,2009-06-16 15:24:09,MEGZIIEELLE,Awwhh not good Ive never seen pink hair dye i want some Better run xD,2009,6,16,15
0,2196435249,2009-06-16 15:28:10,katapie3,suffering through finals studying,2009,6,16,15
0,2196536036,2009-06-16 15:36:05,HarleyPan,Gotta clean the table with the motorcycles quot is every godamn women in this godamn hellhole out of their godamn mind no sir Were j,2009,6,16,15
0,2196538466,2009-06-16 15:36:16,JeremyReaves,Well there are two pairs of leather pants in my closet Hair extensions at Sally But I can t buy the ability to fly,2009,6,16,15
0,2196538835,2009-06-16 15:36:18,Dann607,I just saw a cat get hit by a car not cool,2009,6,16,15
0,2196664375,2009-06-16 15:46:15,twittwootwiggy,if i end up paying 6 a year extra for boradband i wont afford to buy any eggs thats the nxt bnp public meeting ruined,2009,6,16,15
0,2196893907,2009-06-16 16:04:11,jessiemarie424,So frustrated at my job I just wanna scream,2009,6,16,16
0,2196922674,2009-06-16 16:06:24,kteam,perfect excuse to get an iPhone right does suck though,2009,6,16,16
0,2197058829,2009-06-16 16:17:12,eric_arrache,you turned the questions off when I was going to ask if JJ Redick would be a nice fit for the new 76ers,2009,6,16,16
0,2197087784,2009-06-16 16:19:32,Intorion,I don t think so I wont anyway Double Modern Studies D,2009,6,16,16
0,2197107910,2009-06-16 16:21:09,BugsyWorld,FACT on the phone w Bank of America s CUSTOMER SERVICE this SHIT SUCKS wtf 1 Hr i sooo HATE this shit,2009,6,16,16
0,2197162178,2009-06-16 16:25:27,XMichieX,Is stuck at work on this beautiful day,2009,6,16,16
0,2197267109,2009-06-16 16:33:40,xoAdrianne,English exam tommorow AHHHHHH,2009,6,16,16
0,2197469320,2009-06-16 16:49:33,StealingJesus,Rain rain go away stop ruining Taco Tuesday,2009,6,16,16
0,2197515376,2009-06-16 16:53:11,Rosieex23,Vern s leaving for Chi town fridayyayayay Gonna be so bored,2009,6,16,16
0,2197539975,2009-06-16 16:55:06,DaniWatters96,Urgh gt lt 3rd year sucksss,2009,6,16,16
0,2197761778,2009-06-16 18:08:09,lozzam77,I ve had the most bizarre weekend didn t like the feeling it gave me,2009,6,16,18
0,2197807998,2009-06-16 18:12:29,Jeniffer96,why must i miss EVERYTHING apparently LVATT or LinesVinesAndTryingTimes was trending amp where was i sleeping,2009,6,16,18
0,2197830570,2009-06-16 18:14:37,Trendy_Crafts,Is sick of all the rain Trying to figure out what to work on next Maybe cupcakes strawberries or mushroom play food Hmmm,2009,6,16,18
0,2197976547,2009-06-16 18:26:49,CindyheartsJon,I do miss I think he s trying to prepare us for life after july,2009,6,16,18
0,2197996770,2009-06-16 18:28:24,Edeeeeen,I can t DM you back cause you stopped following me,2009,6,16,18
0,2198042382,2009-06-16 18:31:47,zombiesandtoys,World War Z Movie on Hold,2009,6,16,18
0,2198044077,2009-06-16 18:31:55,lorilyg,Our business banker just said I was mean All I was doing was complaining about the fees they charge us to hold all of our money,2009,6,16,18
0,2198097752,2009-06-16 18:36:04,alexleefitz,I miss my love a lot,2009,6,16,18
0,2198146334,2009-06-16 18:40:04,Snugglepuffle,a little annoyed at the moment and bored no live for me today,2009,6,16,18
0,2198312846,2009-06-16 18:54:13,vskan,The things I wouldn t miss if I were uncubicled the clang clang clang of the telephone bells,2009,6,16,18
0,2198335959,2009-06-16 18:56:11,princesslg,I know they actually made me very upset today I had to shed a few tears,2009,6,16,18
0,2198346724,2009-06-16 18:57:07,SweetDarkDreams,I miss I hope she gets better soon,2009,6,16,18
0,2198524698,2009-06-16 19:11:55,goyebr,oh nooo Jack just can t win today can he,2009,6,16,19
0,2198650983,2009-06-16 19:22:34,getmewear,Do I really need to answer that Sorry,2009,6,16,19
0,2198659522,2009-06-16 19:23:19,littledoom,eww just don t look at me like im not standing here dumb ass,2009,6,16,19
0,2198778274,2009-06-16 19:33:28,LisainDallas,HUGS I m so sorry for your loss,2009,6,16,19
0,2199008334,2009-06-16 19:53:25,thefatlosskid,1 1 swim session done sum things wr better sum wr worse Looking 4ward 2 bike w Sam test aero bars amp a kick ass gym session later,2009,6,16,19
0,2199077623,2009-06-16 19:59:33,Caramel_tinny,shout out to my pink freakum dress that I wore to mars that made my ass look HUGE in 06 imma retire that dress,2009,6,16,19
0,2199114331,2009-06-16 20:02:33,musicfreak1747,OH i was SOOO right i kept guessing that earlier today but he never responded back i totally knew it somehow,2009,6,16,20
0,2199116777,2009-06-16 20:02:45,HollyInSD,This thing won t let me direct message you You look very sad to be in that chair,2009,6,16,20
0,2199265235,2009-06-16 20:15:12,spatilinfotech,On the way for Mumbai for a day after only 4 hrs sleep,2009,6,16,20
0,2199296184,2009-06-16 20:17:52,krissymac80,back to reality back to home i m exhausted my ear won t pop from the plane it s stuffy in the house amp my flowers are half dead,2009,6,16,20
0,2199315393,2009-06-16 20:19:34,tangielawschool,Damn someone dented my Cedes and didn t leave a note Damn homie,2009,6,16,20
0,2199341243,2009-06-16 20:21:45,hoalpigs,can t find my cat,2009,6,16,20
0,2199368310,2009-06-16 20:24:07,Miesuku,So true I was fine all winter and NOW I get sick FML,2009,6,16,20
0,2199431960,2009-06-16 20:29:36,super_tahli,i think i have swine flu,2009,6,16,20
0,2199578746,2009-06-16 20:42:16,mw20iscrushin,my handwriting sucks,2009,6,16,20
0,2199618210,2009-06-16 20:45:40,danmanu,all of your links are dead,2009,6,16,20
0,2199623543,2009-06-16 20:46:08,Micron03,Sis got thrown out window today Cant move two fingers has to see plastic surgeon in morning,2009,6,16,20
0,2199690028,2009-06-16 20:51:52,triniebay07,Boreeeeeeeeed,2009,6,16,20
0,2199784208,2009-06-16 20:59:59,My3Nutz,I wore green today in support of Iran Apparently no one else got the memo,2009,6,16,20
0,2199810677,2009-06-16 21:02:07,dmEric,Ran 6 04 miles in 49 mins and felt good Ran the HyVee course with Joe That shit is hilly Not nice hilly either,2009,6,16,21
0,2199832479,2009-06-16 21:03:57,Edeeeeen,Crampers,2009,6,16,21
0,2199850293,2009-06-16 21:05:26,kwatt0311,Only to drag us further backwards,2009,6,16,21
0,2199933573,2009-06-16 21:12:27,chrissibelle,Just got called NIGGER to my face for the first time,2009,6,16,21
0,2199941029,2009-06-16 21:13:03,serenasee,do u realize that u suck at oral,2009,6,16,21
0,2200045592,2009-06-16 21:21:44,kaylaphilpot,About to have a taste of the amish lifestyle No electricity and phones dying,2009,6,16,21
0,2200088135,2009-06-16 21:25:20,nncyfbby,i feel left out,2009,6,16,21
0,2200202678,2009-06-16 21:34:38,Queen_of_Noise,he said he s been in hiding bout 5 hours ago said he was still busy at work isn t home yet need to find,2009,6,16,21
0,2200296627,2009-06-16 21:42:18,TamyraElise,i miss you i better see you guys again soon,2009,6,16,21
0,2200412051,2009-06-16 21:51:53,mindthemoose,I don t know why but I can t seem to stop eating today however I have no money so I ve pretty much had trash too,2009,6,16,21
0,2200460349,2009-06-16 21:55:53,onemac220,Man Long day and I m only half way there,2009,6,16,21
0,2200484959,2009-06-16 21:57:55,thatgirlmaya,asian food makes you feel terrible,2009,6,16,21
0,2200508438,2009-06-16 21:59:52,lexdiamond973,Uuuuuuuuuuuugh another night sleeping alone,2009,6,16,21
0,2200554472,2009-06-16 22:03:26,lane__,I want to go to rainforest cafe,2009,6,16,22
0,2200655392,2009-06-16 22:11:33,awagentx,btw HotD Overkill keeps locking up,2009,6,16,22
0,2200659164,2009-06-16 22:11:51,claudiusava,Have tix for the Cub Sox today and it rained out,2009,6,16,22
0,2200694021,2009-06-16 22:14:44,rjog,introducing Rebreada Breadhorn thanks to my obsession with bread and overconsumption of it for lunch feel sick now,2009,6,16,22
0,2200705363,2009-06-16 22:15:37,Ashly_Nicole,Going to stay with she has an ear infection,2009,6,16,22
0,2200860182,2009-06-16 22:28:28,kellyrenea,What does pneumonia feel like It s really hard to breathe,2009,6,16,22
0,2200907913,2009-06-16 22:32:26,vivientannn,I don t likeeeeeeeeee Haha,2009,6,16,22
0,2200915061,2009-06-16 22:33:02,helloglo,final FroYo Toy Joy Spiderhouse run with and Colton,2009,6,16,22
0,2200924668,2009-06-16 22:33:51,vickir1208,still not getting my tweets why,2009,6,16,22
0,2200932402,2009-06-16 22:34:30,ChesneyWorld,Wish he was there,2009,6,16,22
0,2201087004,2009-06-16 22:47:12,mirandapause,Leaving San Antonio thursday I miss my mommy and daddy,2009,6,16,22
0,2201099624,2009-06-16 22:48:17,DestinyTrack42,I miss you already You better come tomorrow OR ELSE HOLLA,2009,6,16,22
0,2201124896,2009-06-16 22:50:28,KaraLilly,Mood swings and money worries keep me up past my bedtime This sucks,2009,6,16,22
0,2201396077,2009-06-16 23:12:59,JustShemaBaby,i m f n bored and twitter isn t doing the trick guess i ll jus stick to the rules from now on and jus twit what i m doin at the moment,2009,6,16,23
0,2201469575,2009-06-16 23:19:09,anne_is_ranting,Mom s probably talked to me twice since i got home,2009,6,16,23
0,2201540776,2009-06-16 23:25:09,supppashley,WHY DOES MY COMPUTER HATE ME SO MUCH Internet keeps dying freezing,2009,6,16,23
0,2201720356,2009-06-16 23:40:35,kikabkika,I was gona go watch a movie with my brother but he isnt home,2009,6,16,23
0,2201746410,2009-06-16 23:42:49,sjlamoreaux,i only walked 2 miles today i was just too tired to do that last mile oh well i ll just have to catch up tomorrow,2009,6,16,23
0,2201797481,2009-06-16 23:47:19,raerae06,maybe not in that order but I need them sounds like you do as well,2009,6,16,23
0,2201821721,2009-06-16 23:49:28,dluttrel,2 finals down 1 to go 12 days left in australia headed to the uniclub tonight and Byron Bay tomorrow for a few days,2009,6,16,23
0,2201831855,2009-06-16 23:50:22,karling,Ah leila that is so sad,2009,6,16,23
0,2201844676,2009-06-16 23:51:30,BigBein,is stuck in the process of programing my register,2009,6,16,23
0,2201897592,2009-06-16 23:56:11,ggkthx,Sucky Hope it s not too bad and you heal up quick,2009,6,16,23
0,2201903648,2009-06-16 23:56:43,JosephDiazMuisc,can no longer make fun of people who have a twitter account,2009,6,16,23
0,2201970461,2009-06-17 00:02:38,csoro,lt 3broken just on myspace isnt coming to vegas or anywhere close im gonna cry me a river now no fair,2009,6,17,0
0,2201973200,2009-06-17 00:02:53,mariaa10,So sad that im gonna miss the new season premiere of The Secret Life of the American Teenager,2009,6,17,0
0,2202041900,2009-06-17 00:09:06,emmywallace,omg stop complaining i d dieee to be in california right now,2009,6,17,0
0,2202043949,2009-06-17 00:09:17,Labebadesigns,OMGosh i ll go change it right now thanks so much for letting me know,2009,6,17,0
0,2202061875,2009-06-17 00:10:57,jenniferrose_,Are you guys actually fighting If so i hope everything works out No more fighting boys You need to get along,2009,6,17,0
0,2202074392,2009-06-17 00:12:04,bizzy2009,wish I could give you some of this VA rain,2009,6,17,0
0,2202148584,2009-06-17 00:19:04,kissysuzuki,Tuesdays suck Can we change the calendars to Friday through Monday 4 day weeks would be awesome me so sad that it s only hump day,2009,6,17,0
0,2202149245,2009-06-17 00:19:08,hummingbird604,Lucky you Minna I m on the other hand still going,2009,6,17,0
0,2202149816,2009-06-17 00:19:11,littleb0peep,Awe gonna miss madeline while I m gone,2009,6,17,0
0,2202154500,2009-06-17 00:19:40,ericbutcher,OK I really should go mimis now,2009,6,17,0
0,2202160547,2009-06-17 00:20:13,fountaingoats,Nika has a torn ligament in her knee I wonder how expensive this will end up being And no playing for four weeks,2009,6,17,0
0,2202163659,2009-06-17 00:20:30,ZACKORSBORN,TweetDeck keeps crashing I like it though,2009,6,17,0
0,2202267439,2009-06-17 00:30:36,ME143,Ok So I just got tweetdeck LOVE the look and the use But Where s the trending topics,2009,6,17,0
0,2202288495,2009-06-17 00:32:39,its_ang_duhh,i try i try so hard and i seem to get no credit for it wats the prob,2009,6,17,0
0,2202317541,2009-06-17 00:35:35,DCStrickland,I m camping this weekend not back till sunday,2009,6,17,0
0,2202319711,2009-06-17 00:35:48,charma8377,Flu vertigo cramp What a nice compilation Someone get me a kiranti please,2009,6,17,0
0,2202350700,2009-06-17 00:38:56,jennxisxrad,i don have your number bitch but i gave you minde Jennifer,2009,6,17,0
0,2202446311,2009-06-17 00:48:37,XxBABYGiiRLxX,Can t wait to try them all I was a little dissapointed that they said the saltwater wasn t going to be enought for a full bath ohh well,2009,6,17,0
0,2202463165,2009-06-17 00:50:19,kaci_mxm,drinkin a corona while rosco tells me a few of his raunchy ass jokes damn fool sorry about the beer besos xo,2009,6,17,0
0,2202506638,2009-06-17 00:54:56,rainrox10,Tonight was fun Too bad It s my last fun night for a week i need to learn to be honest Who wants to teach me,2009,6,17,0
0,2202512936,2009-06-17 00:55:34,princesssusieq,Bill come into gutreaction RE international feed cut off again,2009,6,17,0
0,2202569738,2009-06-17 01:01:30,Lisaduhh,Work all day tom boo bed early wish it was saturday tom,2009,6,17,1
0,2202573536,2009-06-17 01:01:52,xXJonas_LoveXx,i wish were in the states,2009,6,17,1
0,2202647487,2009-06-17 01:09:42,_Marguerite,Just took an artic shower brr I think the water heaters broken wth,2009,6,17,1
0,2202664944,2009-06-17 01:11:32,jhnphllps,whyyy,2009,6,17,1
0,2202773467,2009-06-17 01:23:21,caralandicho,I still don t want school Nothing beats spending the day at home doing nothing,2009,6,17,1
0,2202829471,2009-06-17 01:29:43,JessicaUno,I have a bad stomach ache in less than a week,2009,6,17,1
0,2202902089,2009-06-17 01:37:53,xZullyZombiex,I have a headache starting from the back of my head to my forehead Oww,2009,6,17,1
0,2202911324,2009-06-17 01:38:59,whoaitsnicolee,WHAT why is who wants to be a millionaire on,2009,6,17,1
0,2202994079,2009-06-17 01:48:50,CharMegan,LOL even so I hate that they re two years ahead of me and they all look so different more mature,2009,6,17,1
0,2203009146,2009-06-17 01:50:38,Chad28,Long day at work today no truck but we have a 2300 peice truck tomorrow yaaah,2009,6,17,1
0,2203023409,2009-06-17 01:52:24,Jean1172,eh not a good position ot be in leh,2009,6,17,1
0,2203045446,2009-06-17 01:55:09,itsabeta,I don t think I have reached the optimum level of hockey mania to have a well fought feud yet One day,2009,6,17,1
0,2203058707,2009-06-17 01:56:47,riitchiie,Is it sad that I just Tweeted from the web and TweetDeck YES YES IT IS,2009,6,17,1
0,2203068630,2009-06-17 01:58:01,_traceface,i miss the times when my horoscope applied to me i am not considering buying a water feature for the house,2009,6,17,1
0,2203129329,2009-06-17 02:05:14,SeanSalcido,getting my class schedule together real world stuff,2009,6,17,2
0,2203140252,2009-06-17 02:06:32,_bron_,Installing Flock yay for yet another browser that is apparently not playing nice with nice site layouts,2009,6,17,2
0,2203160891,2009-06-17 02:09:03,MissMeghan88,im not beatin u up thnx girl 4 insitigatin damn concious is beginning to kick in,2009,6,17,2
0,2203180903,2009-06-17 02:11:24,radu_woodie,my new tour dates next stop hospital sucks,2009,6,17,2
0,2203277948,2009-06-17 02:23:32,carineybean,i have a headache,2009,6,17,2
0,2203298491,2009-06-17 02:26:09,GlamorKillsMiki,Need new skinnies I like my old ones,2009,6,17,2
0,2203326473,2009-06-17 02:29:48,progressive_dan,wish I could be at the KCE straw poll I have finals will be at the forums on June 25 though,2009,6,17,2
0,2203382372,2009-06-17 02:37:01,ainazhar,wahhhh it s seriously very noisy right now i can t even study,2009,6,17,2
0,2203456845,2009-06-17 02:46:58,trishaareyes,someone unfollowed me,2009,6,17,2
0,2203586936,2009-06-17 03:04:24,KirstyHxxx,have to leave you now going for school bus Biology test today I think i m going to fail anyway bye,2009,6,17,3
0,2203597735,2009-06-17 03:05:49,sashaporter7,is doing homework,2009,6,17,3
0,2203626646,2009-06-17 03:09:46,cocoa_puff,Ugh I should really stop and go home but I m finally on a roll If I stop now I know I ll be stuck when I wake up in the morning,2009,6,17,3
0,2203640134,2009-06-17 03:11:33,mordor0001,X ray showed compression fracture of T11vertebra kinda explains the discomfort I have had the last 5 weeks so no mtb for a while,2009,6,17,3
0,2203645572,2009-06-17 03:12:18,niwuslyke,is confused amp torn,2009,6,17,3
0,2203650992,2009-06-17 03:13:03,iamhungryyay,Dome lepaking with Charlene now I need to pee,2009,6,17,3
0,2203681849,2009-06-17 03:17:17,nuevosrucos,im up still working 12 17 am over here,2009,6,17,3
0,2203705007,2009-06-17 03:20:28,camgroth,Wordpress upgrade has ruined my blog Can t see text when making new posts and error msgs everywhere in admin screen Moving to blogger,2009,6,17,3
0,2203729817,2009-06-17 03:24:00,ockwerdsylence,I was semi productive today but I got a parking ticket in the process,2009,6,17,3
0,2203800188,2009-06-17 03:33:54,ohjaytee,Time to feed the masses aka pets It s cold outside,2009,6,17,3
0,2203816707,2009-06-17 03:36:16,Baleyrocks23,some random house look Its still dling bawl its taking forever,2009,6,17,3
0,2203869659,2009-06-17 03:44:14,sparkadiah,Someone tell Sulka to read the uservoice emails Can t get into beta still,2009,6,17,3
0,2203917440,2009-06-17 03:51:29,KimSuzzane,lol no just made a little baby cry today and now he thinks i m really mean,2009,6,17,3
0,2203919790,2009-06-17 03:51:51,n0tin,I think there is 15 people here who wrote quot TWITTERRRRRRRR quot about me,2009,6,17,3
0,2204026553,2009-06-17 04:07:56,xJASAMINAx,is off shopping today should be lookin for outfit for the wedding but just no time or money,2009,6,17,4
0,2204064333,2009-06-17 04:13:50,shakubha,missin mah frnds,2009,6,17,4
0,2204193655,2009-06-17 04:34:06,sakidoll,i missed it tho that s probably for the best i may have gotten in a bit of trouble hehe i find such to be quite arousing,2009,6,17,4
0,2204221614,2009-06-17 04:38:38,weldmar,We ve had to cancel the Weldmar Black amp White Ball on 4 July 2009 I was looking forward to it,2009,6,17,4
0,2204231208,2009-06-17 04:40:11,Art_IFicial,OMG I totally feel the same way,2009,6,17,4
0,2204247827,2009-06-17 04:42:52,Spidersamm,grrrrrrrr i didnt even tweet much while i was at school because i was saving my battery for after amp you didnt even call,2009,6,17,4
0,2204281948,2009-06-17 04:48:23,lorihooood,please dont i hit it and it started to get more agressive,2009,6,17,4
0,2204287099,2009-06-17 04:49:15,anirbanchatz,pentax DA70mm f 2 4 2buy 2buy tough equation,2009,6,17,4
0,2204289028,2009-06-17 04:49:34,CapnScarlett,apparrently it won t be at jb penrith til saaturday,2009,6,17,4
0,2204407534,2009-06-17 05:08:12,RustlingRagazza,Are you OK Why home from work two days in a row,2009,6,17,5
0,2204408895,2009-06-17 05:08:25,bitBrit,Just woke up So hot and tired sore throat too,2009,6,17,5
0,2204433171,2009-06-17 05:12:12,hannaaa10,I m ontheway to cengkareng airport bye tweeps,2009,6,17,5
0,2204440636,2009-06-17 05:13:25,zrchua,Coco is nibbling on my Hello Kitty mouse,2009,6,17,5
0,2204567405,2009-06-17 05:33:20,lisaparkk,How come I have such difficulty sleeping,2009,6,17,5
0,2204573686,2009-06-17 05:34:21,troozers,unfortunately not at my winblows PC with iTunes installed so no idea,2009,6,17,5
0,2204576896,2009-06-17 05:34:52,alexispratsides,31 is nothing I ll be chalking up 35 next birthday,2009,6,17,5
0,2204605125,2009-06-17 05:39:27,southportlush,I would go green in support of democracy in the iranelection if I had a scoobydoo how to grr why am I such a techno dunce,2009,6,17,5
0,2204688889,2009-06-17 05:52:44,mishko27,yes chief thew signs arent good no call no sms no email,2009,6,17,5
0,2204701744,2009-06-17 05:54:48,djvue,Oh the pain my back is killing me,2009,6,17,5
0,2204702062,2009-06-17 05:54:51,_melacar,sorry i totally fell asleep,2009,6,17,5
0,2204763612,2009-06-17 06:04:06,GracieSurtees,had a brill day yesterday visiting all the magazines but feels very tired today,2009,6,17,6
0,2204812510,2009-06-17 06:11:49,xMelBromm,im sorry tori that i made you cry i feel so bad,2009,6,17,6
0,2204885260,2009-06-17 06:23:31,_mel_,Denied by the Chronic closed boo going to try Taiwan on recommendation by Hmm touchscreen ordering,2009,6,17,6
0,2204958729,2009-06-17 06:35:04,vicky_scarlett,Had my last stabbing at GP now to get on with some more packing,2009,6,17,6
0,2204964985,2009-06-17 06:36:02,andreacbravob,Where s my iPhone OS 3 0,2009,6,17,6
0,2204965371,2009-06-17 06:36:06,ILYmieke,I hate delays,2009,6,17,6
0,2205012998,2009-06-17 06:43:43,avstansfield,i wish some people would just spit it out if u have a problem just say kbbz haha work time rain 9 hour shift,2009,6,17,6
0,2205015410,2009-06-17 06:44:05,glitchkitty,I bet it felt like Christmas came early for Jack Thompson reading that Kid sounds like a nutter Not the game s fault,2009,6,17,6
0,2205105397,2009-06-17 06:58:24,Wirelessmonkey,Cant wait for this weekend possibly the last British GP At silverstone that i will go to DAMN YOU BERNIE,2009,6,17,6
0,2205206760,2009-06-17 07:12:54,christinamakar,have an allergy cold and have to go to work and can t wait to get my hair done on friday,2009,6,17,7
0,2205234994,2009-06-17 07:16:57,SophietheFrog,Horrible weather Just my fucking luck there would be no buses,2009,6,17,7
0,2205239954,2009-06-17 07:17:40,backupgeek,Thanks Apple for holding my iPhone in Louisville I really didn t want it early anyway,2009,6,17,7
0,2205293481,2009-06-17 07:25:06,Adella1211,tucked up in bed feeling crappy,2009,6,17,7
