target,id,date,user,text,year,month,day,hour
0,2263234789,2009-06-21 03:17:06,gabeezy,haha aww it was in response to your hubbz we had a mini convo haha read it,2009,6,21,3
0,2263243746,2009-06-21 03:18:29,quoll,Oops hit enter too soon Yeah we re OK Just tired Also the 2 hour timezone shift is confusing 2am and I m still up,2009,6,21,3
0,2263290691,2009-06-21 03:25:40,sarahhhhhs,i don t want to be this,2009,6,21,3
0,2263441986,2009-06-21 03:49:29,bamitsgabbby,has a super bad pain in her side,2009,6,21,3
0,2263488555,2009-06-21 03:57:13,Gill_Fairley,The summer solstice amp longest day today From now on the days get shorter It kind of feels like downhill to winter,2009,6,21,3
0,2263539248,2009-06-21 04:05:29,sprinkles_,havent done a misi find blog in ages i should do one just dont like missing people out,2009,6,21,4
0,2263567178,2009-06-21 04:10:13,elenafilip,I wanna afford to loose a day or 2 pana arunci analiza economco financiara bleah,2009,6,21,4
0,2263571209,2009-06-21 04:10:54,arpitsrivastava,LAN connection failed No Counter Strike,2009,6,21,4
0,2263667085,2009-06-21 04:27:35,sPermadhy,Team Yellow aka me Danny lost,2009,6,21,4
0,2263673423,2009-06-21 04:28:43,lovebscott,Am I the only one that can t sleep and mad because everything on television sucks,2009,6,21,4
0,2263774271,2009-06-21 04:46:22,coolforkat,Me and mike should have come with ya seeing as if I m not goin to glasto gutted enjoyd ur breakie now get walkin Lol,2009,6,21,4
0,2263936791,2009-06-21 05:15:47,han555,day off w00p shame i dont really feel very well,2009,6,21,5
0,2263966824,2009-06-21 05:21:19,bluestatus,whether you take my offer not Hate seeing people all down and shit That s lame,2009,6,21,5
0,2264008306,2009-06-21 05:29:27,Kadyxxx,maybe i should shut up when i have a quite day or 2 i get more followers lol hellooo new people guess what im tiiiired,2009,6,21,5
0,2264050827,2009-06-21 05:37:27,SammieEidukas,Happy Daddys Day Daddy Even Though Your In London Hugs And Kisses Work At 12,2009,6,21,5
0,2264057601,2009-06-21 05:38:49,lauzmur,lmao why when i want to go on urbandictionary do i type in urbanoutfitters it happens ALL the time,2009,6,21,5
0,2264143170,2009-06-21 05:55:31,RomaineMadeline,I lost my favourite little boy today my baby brother How do I eat smile or do anything He was only 16 months old It s not fair,2009,6,21,5
0,2264226129,2009-06-21 06:10:57,HollieElder,wants to live in america,2009,6,21,6
0,2264287747,2009-06-21 06:23:01,Vicstar,you re welcome i know it must suck for you tiday not being able to be with yr kids big hug,2009,6,21,6
0,2264320847,2009-06-21 06:29:44,Tanya_xO,time for work caio be back later when im completely drained x,2009,6,21,6
0,2264439198,2009-06-21 06:52:34,va_songstress,hey you I see u don t convers with me anymore Ugh Fine be that way,2009,6,21,6
0,2264517061,2009-06-21 07:07:13,chrismgallen,mine on the other hand seems to be,2009,6,21,7
0,2264534744,2009-06-21 07:10:35,IDunnO_Galaxy,GD owes me hug Ugh no its okay boney hugs won t make me happi I m still upset,2009,6,21,7
0,2264565154,2009-06-21 07:16:17,iamsarahlou,Back home and unpacking everything Missing the free food and booze,2009,6,21,7
0,2264638787,2009-06-21 07:30:02,EMIxXXXx,Gr8 Weekend Thanx to Poppy Steph Page amp Matt Ly All Cameron Clarke ILY But you dont Feel The Same Thats What Makes Me hate you LY All,2009,6,21,7
0,2264642476,2009-06-21 07:30:36,gary_goh,is going to spend less from next week onwards,2009,6,21,7
0,2264708756,2009-06-21 07:42:42,Nicole224462,scared my dress isn t going to come in time fingers crossed,2009,6,21,7
0,2264730411,2009-06-21 07:46:37,hussainhaidry,I want a job As in one that pays me at the end of the month,2009,6,21,7
0,2264760801,2009-06-21 07:51:52,checkedin,You may solve this issue by reimporting all projects data files every time you reopen the project Finally the export is broken f this,2009,6,21,7
0,2264818269,2009-06-21 08:01:42,JoLedell,My hair will down off soon in no time ASSIGNMENTS,2009,6,21,8
0,2264829985,2009-06-21 08:03:41,gregsaturday,restoring miggy now because i messed up his icons and stuff,2009,6,21,8
0,2264868922,2009-06-21 08:10:14,pvctrinidad,is missing someone she should NOT be missing,2009,6,21,8
0,2264932638,2009-06-21 08:20:50,PoynterJones,It s hard though Like my favourite food is spaghetti I can t not eat spaghetti Sob,2009,6,21,8
0,2265072542,2009-06-21 08:43:03,Screenhog67456,New Post on my site Big announcement I m quitting CP,2009,6,21,8
0,2265124036,2009-06-21 08:50:55,KaiBass,i miss u,2009,6,21,8
0,2265155191,2009-06-21 08:55:29,aleeeeexa,I was on the verge of passing out inside the church earlier,2009,6,21,8
0,2265200090,2009-06-21 09:01:49,scottbwilliams1,sitting in my office office paying the bills,2009,6,21,9
0,2265328508,2009-06-21 09:20:05,LaRhythm,oh haaha 1st I thought u said she hate s me i was like WHAT DID I DO,2009,6,21,9
0,2265464635,2009-06-21 09:38:28,SuBpk10,Chillin bored and tired,2009,6,21,9
0,2265490336,2009-06-21 09:41:50,_caaaroline,I ve actually sat on my ass long enough for it to be numb I miss my sisters laptop,2009,6,21,9
0,2265524191,2009-06-21 09:46:15,fissionxuiptz,oh god that s horrible news So sorry to hear that How s she holding up,2009,6,21,9
0,2265592116,2009-06-21 09:55:04,BaByCatXD,Financial accounting exam TODAY last day at the canadian association of magicians convention,2009,6,21,9
0,2265648433,2009-06-21 10:01:53,bitterb,Unfortunately the photos amp tweets I tried to send from the wedding yesterday didn t work On MD s eastern shore we could only get Edge,2009,6,21,10
0,2265741217,2009-06-21 10:13:03,jessfairley,i really cbaa doing coursework gahh,2009,6,21,10
0,2265811690,2009-06-21 10:21:23,otaliafan87,Eevetybody from big purple dreams I just read spoilers where somebody put donw its natalia who is pregant omg what will olivia do now,2009,6,21,10
0,2265843701,2009-06-21 10:25:11,Tango_Elle,I didn t watch it yet I been runnin around like crazy proly won t be able to c it til this upcoming wknd,2009,6,21,10
0,2265905179,2009-06-21 10:32:12,BuzzRoyale,I have to iron my clothes now,2009,6,21,10
0,2265964977,2009-06-21 10:39:04,JayLittonJr,is missing his dad more than ever on fathers day,2009,6,21,10
0,2266024497,2009-06-21 10:45:43,iSCOOPofficial,Editing new show Sorry it s gonna up on YouTube so late,2009,6,21,10
0,2266127169,2009-06-21 10:57:21,Holliieeeee,ahhh mcfly depressionn so sad its all over wish i could build a time machine and go again,2009,6,21,10
0,2266140681,2009-06-21 10:58:52,xTwilighter,Just kinda doing Nothing School tomorrow,2009,6,21,10
0,2266152022,2009-06-21 11:00:05,ElisaMariee,hes never coming back,2009,6,21,11
0,2266229197,2009-06-21 11:08:11,fallinginlovee,Stupid channel 10 has to put The Biggest Loser and the Grand Prix on before Harpers Island,2009,6,21,11
0,2266271189,2009-06-21 11:12:43,njeeess,somebody please make me understand about twitter,2009,6,21,11
0,2266320412,2009-06-21 11:17:58,oflahertie,Haha but really I still like the little babies Poor them,2009,6,21,11
0,2266365746,2009-06-21 11:22:52,Fiskmat,I had no idea damn annoying,2009,6,21,11
0,2266432418,2009-06-21 11:30:00,Busyme,You re lucky your gym has ANY classes on Sunday Mine doesn t,2009,6,21,11
0,2266552610,2009-06-21 11:42:17,Tuddy95,doing English hw,2009,6,21,11
0,2266613516,2009-06-21 11:48:30,BlauerPanther,oh it seems you are not happy like this Poor little girl I m feeling pity for you,2009,6,21,11
0,2266683374,2009-06-21 11:55:43,AngryChad,Thanks Tekzilla for reminding me about the squarespace iPhone giveaway I think I forgot yesterday,2009,6,21,11
0,2266792322,2009-06-21 12:06:30,tiffanye,Missed the ENTIRE wedding reception because I was in the hospital Feel like I have a broken back but have sprained neck back amp ankle,2009,6,21,12
0,2266818045,2009-06-21 12:09:05,genericgirl,Hurt my lip last night it s swollen and slightly infected,2009,6,21,12
0,2266860771,2009-06-21 12:13:16,maioush,I DO 11 hours kaman shayfeh el 7ayah,2009,6,21,12
0,2267008419,2009-06-21 12:28:21,PoFoSho,I miss cember the princess,2009,6,21,12
0,2267120050,2009-06-21 12:39:32,unfnshdrambler,between you and neither one of you had a good day Friday,2009,6,21,12
0,2267198213,2009-06-21 12:47:05,oliiviia,jb is in toronto soundchecking,2009,6,21,12
0,2282251066,2009-06-22 14:07:54,KLBarber,Have just been stopped twice in the street no less offering me a discounted makeover Imustlookrough,2009,6,22,14
0,2282658070,2009-06-22 14:38:45,janetmulligan,is astounded that her IPA is TOO HOPPY and over attenuated Time to leave it to mellow,2009,6,22,14
0,2282967332,2009-06-22 15:02:07,thenove,alright i found one but they re out of stock,2009,6,22,15
0,2282996340,2009-06-22 15:04:19,keharrel,can t believe i m turning 40 tomorrow really missing kerry and wanted her celebrating with me,2009,6,22,15
0,2283462306,2009-06-22 15:39:31,JennyGenocide,SAY BOY WHERE YOU BEEN text me i lost all my numbers on my sim card,2009,6,22,15
0,2283499100,2009-06-22 15:42:17,Rani_Vampyress,I went from 101 followers to 98 I felt important for a few hours,2009,6,22,15
0,2283608540,2009-06-22 15:50:39,ichienkai,thats just more technology to deal with lol,2009,6,22,15
0,2283678102,2009-06-22 15:56:01,sunkistgirl303,WHAT NO DONT GO WE HAVEN T TALKED YET,2009,6,22,15
0,2283762770,2009-06-22 16:02:17,TaterPA,The ice melted Now I m all wet,2009,6,22,16
0,2283894986,2009-06-22 16:12:08,asgolfas123,So sad to see Phil come so close just to finish 2nd yet again,2009,6,22,16
0,2284037890,2009-06-22 16:23:02,katlynw02,I can t believe I missed this I was in the hospital You probably don t make it out here that often either,2009,6,22,16
0,2284120821,2009-06-22 16:29:24,asmith14,Jennifer i will probably have to walk but my dad said not to talk to him right now,2009,6,22,16
0,2284515127,2009-06-22 16:58:44,MorningMajor,It dive bombed me not once but again and again ps never caught the bugger anyway,2009,6,22,16
0,2284718534,2009-06-22 17:13:46,alessiaguarnera,My ears are really burning up,2009,6,22,17
0,2284823242,2009-06-22 17:21:39,eliafierce,sad but I saw it coming,2009,6,22,17
0,2284902974,2009-06-22 17:27:39,allissatweet,I m on Team Perez can t believe people are saying such mean stuff,2009,6,22,17
0,2285009754,2009-06-22 17:35:38,NeoCydude,wait it s Monday crap,2009,6,22,17
0,2285341259,2009-06-22 18:00:38,vegasstace,exactly Did you read about J amp K 8,2009,6,22,18
0,2285351826,2009-06-22 18:01:26,KatyLinda,Prayers for all the victims of the DC Metro crash how tragic,2009,6,22,18
0,2285555739,2009-06-22 18:16:43,Tripod527,i didnt say that sorry babe,2009,6,22,18
0,2285720092,2009-06-22 18:29:36,M_a_R_s_87,GoodNight again earthquake here in Italy,2009,6,22,18
0,2285945353,2009-06-22 18:47:30,trespetitellie,Sick blah Lots of house and crosswords,2009,6,22,18
0,2286002795,2009-06-22 18:52:05,Saundraaa,Crappy Shitty No good ppl I can t count on anyone these days,2009,6,22,18
0,2286005742,2009-06-22 18:52:18,melethril,Reading aloud bedtime story this month is Lords and Ladies by Terry Pratchett No silly voices yet,2009,6,22,18
0,2286007335,2009-06-22 18:52:26,Derek_DeLeon,My scratched Halo 3,2009,6,22,18
0,2286020677,2009-06-22 18:53:31,EEElaine,aww i tried talking to you on that stupid myspace IM thing myspace is always slow,2009,6,22,18
0,2286048768,2009-06-22 18:55:45,CYBoucher,nervous for jon and kate tonight,2009,6,22,18
0,2286195575,2009-06-22 19:07:17,Melissa_Sav,Can t get the image of Neda out of my head,2009,6,22,19
0,2286218293,2009-06-22 19:09:06,kaseylozano,Wish i had been pimpin out the ride with THE pimp herself and tor,2009,6,22,19
0,2286444040,2009-06-22 19:27:17,CheriLoRo,ugh have to clean the house,2009,6,22,19
0,2286567886,2009-06-22 19:37:25,kconxo,the gosslins,2009,6,22,19
0,2286620018,2009-06-22 19:41:42,candacebwilson,My kiddo hates the pool,2009,6,22,19
0,2286889809,2009-06-22 20:03:55,dungeh55,i actually really wanna seed miley cyrus when she comes to the uk but shes sold out maybe i should just grow up and forget about it,2009,6,22,20
0,2286915003,2009-06-22 20:05:56,AriadnaMiranda,IM SLOW and a dork i mispelled BSB,2009,6,22,20
0,2286915923,2009-06-22 20:06:01,simplynataliee,my mother is up setting me,2009,6,22,20
0,2287020580,2009-06-22 20:14:35,MikeAyeCribs,Ur Mean To Me Now I Dont Even Get Replys Anymore,2009,6,22,20
0,2288066999,2009-06-22 21:40:31,steppingonlegos,omg soooo hungry these commercials are like torture right now I ve had a grand total of a choc milkshake and a yogurt in 24 hrs jk8,2009,6,22,21
0,2288220194,2009-06-22 21:52:40,minnickkatie,Just had to cross meet the gosselin s off my bucket list Why Because they are no longer a family,2009,6,22,21
0,2288285829,2009-06-22 21:57:51,ash_hum,OMG Can NOT believe what just happened on The Bachelorette Love Jake Aww,2009,6,22,21
0,2288421861,2009-06-22 22:08:29,NeofitaJonatik,Watchin a video of JB i miss u guys,2009,6,22,22
0,2288428782,2009-06-22 22:09:00,meliimelz,i ate too many sour skittles and now my tummy hurts LOL,2009,6,22,22
0,2288445912,2009-06-22 22:10:19,BebeInToyland,aww xoxo for ur knee btw the sore on my foot got worse haha,2009,6,22,22
0,2288532299,2009-06-22 22:17:01,babeeshop,Hey rocketband SAY HI TO BRAZIL GUYS rocketband live gt,2009,6,22,22
0,2288650040,2009-06-22 22:26:20,RyanV11,goin to bed,2009,6,22,22
0,2288710889,2009-06-22 22:31:03,awyeahbabe,Today has not been successful,2009,6,22,22
0,2288714045,2009-06-22 22:31:18,mobile_divide,WiFi only though right,2009,6,22,22
0,2288753260,2009-06-22 22:34:25,knottiejezebel,has to have a root canal tomorrow then a crown and a few weeks later have a wisdom tooth pulled,2009,6,22,22
0,2288780128,2009-06-22 22:36:32,vic_wired,Garbage workers on strike I can live with that Liquor Control could strike on Wed People gotta drink during a recession Oh man,2009,6,22,22
0,2288808311,2009-06-22 22:38:49,Jaycee369,is there ANY permament spell that can be casted on to relief headaches for life,2009,6,22,22
0,2288809820,2009-06-22 22:38:56,firigon,missed the UGNAYAN meeting again,2009,6,22,22
0,2289555146,2009-06-22 23:38:37,StrictlyMelii,wish i knew how to play the guitar,2009,6,22,23
0,2289639890,2009-06-22 23:45:44,kabubacabra,found out my grandma is at the hospital I want to visit her so bad but she s 16 hours away from me,2009,6,22,23
0,2295226862,2009-06-23 10:39:05,jlrein,ugh goin to school only 10 more days of this shit,2009,6,23,10
0,2295318861,2009-06-23 10:46:22,Bdazzld,Dad had a serious heart attack Sunday around 6 pm Stubborn man didn t get to a hospital until 7 or 8 LAST night One artery 100 blocked,2009,6,23,10
0,2295319337,2009-06-23 10:46:24,ginatufano,Brokers Open 20440 River Bank Street Sterling then run home to sick 10yo stinky start to summer vacay,2009,6,23,10
0,2295366459,2009-06-23 10:50:07,ELLIOTTFRANKS,I have just counted 93 UNCREDITED pictures in today s Evening Standard Shame on you All staffers amp commissions seem to be credited,2009,6,23,10
0,2295442854,2009-06-23 10:56:04,Elekris,last normal day of school tomorrow Sooo sad But still haappy because I am looking forward to the summer and boarding school next year,2009,6,23,10
0,2295464840,2009-06-23 10:57:47,ToDean,Orientation almost over and I m a little sad,2009,6,23,10
0,2295523339,2009-06-23 11:02:12,CHINABRW,ok got to go in some pain,2009,6,23,11
0,2295529008,2009-06-23 11:02:38,Kelleighna,hahaha my mom is home till 11 30 what about tanning and running,2009,6,23,11
0,2295542183,2009-06-23 11:03:38,SitdownNana,Lots to do today but I m so exhausted I don t want to do any of it,2009,6,23,11
0,2295558403,2009-06-23 11:04:53,dstarpro,Sigh I m actually waiting for a new AC adapter so I can charge if that doesn t work I have to swap out the motherboard,2009,6,23,11
0,2295764199,2009-06-23 11:20:45,leleleo,It s sooo freezing cold outside,2009,6,23,11
0,2295885058,2009-06-23 11:29:56,xSkreaMx,Yeah and my lifes pretty much revolving around odd socks aswell Living out of suitcases right now quot Welcome to my world quot haha x,2009,6,23,11
0,2296009190,2009-06-23 11:39:13,hychanhan,1 by 1 really Yooooo,2009,6,23,11
0,2296094090,2009-06-23 11:45:33,kuthil,cofused,2009,6,23,11
0,2296100731,2009-06-23 11:46:03,blew1,Keep grinding You are just getting it out of your system for the Tournament,2009,6,23,11
0,2296221893,2009-06-23 11:55:05,MilkshakeManCP,How come all my favorite celebs are dying,2009,6,23,11
0,2296259239,2009-06-23 11:57:52,Blablurn,just watched dragonball evolution with 2 of my friends such a bad movie but i bett the second one will be much better,2009,6,23,11
0,2296268173,2009-06-23 11:58:32,MeccaStarr,Excuse me LoL I wish sum1 culd make me sum food right now i wanna get bck in my bed,2009,6,23,11
0,2296277826,2009-06-23 11:59:17,RLangley09,Defo Failed my GCSE Maths,2009,6,23,11
0,2296553042,2009-06-23 12:19:31,yaxenduff,soso lah I BET TIMBRE WAS FUN Saw your pokerface tweet and all BOOO WE SHOULD GO THERE ONE DAY,2009,6,23,12
0,2296592859,2009-06-23 12:22:31,Myrna_nnj,If i had a penny for every time i thought of you i would be a millionaire ten times over by now,2009,6,23,12
0,2296905488,2009-06-23 12:45:59,jayfan3lawrence,whats good yea i missed her here in may and june shes coming back november but the sites messing up,2009,6,23,12
0,2296917475,2009-06-23 12:47:25,Emmax33,school was okay tired now mum ss moaning i think,2009,6,23,12
0,2296931534,2009-06-23 12:48:56,lightsoutside,Feeling anxious recently Think it s cos I can t see anything positive happening to me in the near future Novel is going nowhere,2009,6,23,12
0,2296936245,2009-06-23 12:49:23,steeliXS,I appear to have lost my Nirvana MTV Unplugged CD Waagh,2009,6,23,12
0,2296956123,2009-06-23 12:50:57,zeynepsedef,drinking Turkish coffee wish someone could read my coffee cup,2009,6,23,12
0,2297096672,2009-06-23 13:01:22,KristyJoLuvsJB,Thunder Lightning CRASH CRASH CRASH omg it was sooo scary lol,2009,6,23,13
0,2297627276,2009-06-23 13:40:31,orphanth,but at least it s not will,2009,6,23,13
0,2297655146,2009-06-23 13:42:35,pattyyb,Im eating lasagna ur favorite food,2009,6,23,13
0,2297771251,2009-06-23 13:51:12,mattatat,nevermind it s not on,2009,6,23,13
0,2297788739,2009-06-23 13:52:29,christalovesjb,power was out last night very strange so going to dads TODAY and leaving for ohio tomorrow,2009,6,23,13
0,2297989433,2009-06-23 14:07:11,Mattizilish,going out for a jog in bout half hour gotta slim down I m too fat according to Chris Jack reply to my texts i know you have credit,2009,6,23,14
0,2298132102,2009-06-23 14:17:44,digitaldept,I just get used to PayPal s creative accounting techniques and now they ve changed it Now fees are quot hidden quot within transactions,2009,6,23,14
0,2298299800,2009-06-23 14:30:19,tinyvamp,its my fav tooo ugh he ruined that song for you bb im sorry,2009,6,23,14
0,2298319060,2009-06-23 14:31:44,SHOONEYDARAPPER,working trying to kill any one,2009,6,23,14
0,2298521189,2009-06-23 14:46:55,morganleblanc,stop being so excited to leave,2009,6,23,14
0,2298537919,2009-06-23 14:48:10,RustlingRagazza,Very familiar feeling The worst thing in the world is waiting for it to happen,2009,6,23,14
0,2298546592,2009-06-23 14:48:48,MeganoE,ugh why is it so hard to find a job now and believe me i need one bad,2009,6,23,14
0,2298548324,2009-06-23 14:48:57,Twelv12,What is it 2 do n Denver,2009,6,23,14
0,2298651572,2009-06-23 14:56:44,JustOneMiss,I haven t got it yet,2009,6,23,14
0,2298683244,2009-06-23 14:59:10,Swathii,confused literally in a dilema,2009,6,23,14
0,2298752660,2009-06-23 15:04:11,IMlisacowan,i miss abby aha stupid rich i say hes stealing her off me,2009,6,23,15
0,2298933840,2009-06-23 15:17:38,Jackie96,Is so sad that Marshal died on secret life,2009,6,23,15
0,2299160755,2009-06-23 15:34:39,Jazzix08,just got home amp im already exhausted but i still have a long day ahead of me yay,2009,6,23,15
0,2299163148,2009-06-23 15:34:50,katiebeyotch,waaay too much going on in the world today my little bubble is about to burst my heart goes out to all affected by the metro accident,2009,6,23,15
0,2299608814,2009-06-23 16:07:33,_Ailish_x,I m soo oober lucky to have good friends 7 whole weeks without them,2009,6,23,16
0,2299697851,2009-06-23 16:14:06,creativelyfresh,is it me or is real estate sign buying just a hassle I cant seem to find a local company that will make real estate signs,2009,6,23,16
0,2299790911,2009-06-23 16:20:59,CalDeezy,seriously can NOT concentrate i m going to fail this paper,2009,6,23,16
0,2299962488,2009-06-23 16:33:45,kristinaishere,A tree fell down outside Adams office window and power went out in both our buildings gusts up to 70mph with large hail,2009,6,23,16
0,2299984898,2009-06-23 16:35:25,phatelara,Accident apa Shem,2009,6,23,16
0,2300098558,2009-06-23 16:43:49,fantasticlife,i will die never having seen kobe,2009,6,23,16
0,2300162030,2009-06-23 16:48:28,mikomercer,It may be sunny now but the weather does NOT look favorable for tomorrow s NY outing to the Mets game,2009,6,23,16
0,2300305786,2009-06-23 16:59:08,LadybugLise,A Coney Island is amazing You d have loved the Mermaid Day Parade So many cool things to see I miss you Rebert,2009,6,23,16
0,2300394565,2009-06-23 17:05:33,Sloaneyyy,aww well mine is by choice haha,2009,6,23,17
0,2300420293,2009-06-23 17:07:27,haayleey,whoever created popcorn is a genious who thought to heat corn seeds up untill they pop unless they are man made seeds,2009,6,23,17
0,2300694651,2009-06-23 17:28:30,juansikota,I ve just got back home,2009,6,23,17
0,2300745867,2009-06-23 17:32:22,nigelrunner,I m not up next week I wish I was I d have a ticket I think I m in Kendal Maybe I should take a sicky Let me know how much,2009,6,23,17
0,2300824150,2009-06-23 17:38:21,JenniferJarrell,realizing I have so many things left on my to do list,2009,6,23,17
0,2300888860,2009-06-23 17:43:25,LupitaMarquez,aww mi mari i hope you feel better omg a senior already time passes by so fast o,2009,6,23,17
0,2300893504,2009-06-23 17:43:48,Yeahman85,Outside is great Ice cream why you didn t come down my block,2009,6,23,17
0,2301044054,2009-06-23 17:55:37,tjsr,The local IGA need to pull their finger out they only ever have Mocha Iced Coffee and Banana Big Ms in the morning after I ride in,2009,6,23,17
0,2301075452,2009-06-23 17:58:07,Fariha14_Fiya,ooh Bill why did you kill,2009,6,23,17
0,2301097970,2009-06-23 17:59:55,beciam,I still wish I could be somewhere hot and tropical with great coffee maybe some quality friends and great food too hmmm,2009,6,23,17
0,2301253561,2009-06-23 18:11:54,mathieule,why is the train late,2009,6,23,18
0,2301302443,2009-06-23 18:15:45,Garms,a my bad you can borrow my roller blades in the meantime lolz,2009,6,23,18
0,2301302840,2009-06-23 18:15:46,superbinternet,got one feed working but this feed isn t Trying different settings amp looked at forums help,2009,6,23,18
0,2301415775,2009-06-23 18:24:43,honeybeee23,doesn t know what to cook for dinner,2009,6,23,18
0,2301464205,2009-06-23 18:28:34,Louis_J,Damn no one Das messed up Ppl only watch out for theirselves these days,2009,6,23,18
0,2301780316,2009-06-23 18:54:11,ainasevilla,school now and the rain s going away,2009,6,23,18
0,2301801370,2009-06-23 18:55:52,saahmed1,Pieces of litter showing up around my neighbourhood TOstrike,2009,6,23,18
0,2301839017,2009-06-23 18:59:00,ashxattack,i wanna pinkberry,2009,6,23,18
0,2301957393,2009-06-23 19:08:30,J_Logic,Having the flu sux balls Took all my strength just to write this doh,2009,6,23,19
0,2302023592,2009-06-23 19:13:57,BlackOut0189,My neighbor just stopped by to show me she got her head shaved since she s leaving for the army in a week,2009,6,23,19
0,2302203316,2009-06-23 19:28:53,NellyInDaLoop,i hope she aint got the same sickness as me,2009,6,23,19
0,2302205974,2009-06-23 19:29:06,charliebcurran,Anyone down for transformers 2 tonight at midnight text me Im at work,2009,6,23,19
0,2302221784,2009-06-23 19:30:21,daisyvarley,Wes you suck with your hidden agenda,2009,6,23,19
0,2302275746,2009-06-23 19:34:54,chylalyla,my fave blk stilleto heels r officially dunzo after 2day time 4 a brand new pair but i lt 3 these sooo much,2009,6,23,19
0,2302493757,2009-06-23 19:53:20,gwbowen2008,guess i best get back 2 wrk i overstayed my half hour break long enough big sigh LB,2009,6,23,19
0,2302495807,2009-06-23 19:53:30,ElizabethSmitty,The house needs to be quarantined We are both sick,2009,6,23,19
0,2302541586,2009-06-23 19:57:22,mldrfan,aw wow that would be so amazing to see,2009,6,23,19
0,2302597780,2009-06-23 20:01:58,spelchec,Took to Stoney River My stomach does not know how to expand,2009,6,23,20
0,2302606687,2009-06-23 20:02:41,DarkGlamKitty,Was so sick the last 2 days Not making any videos until Friday,2009,6,23,20
0,2302628520,2009-06-23 20:04:28,gabyhi,feel like going camping miss the outdoors,2009,6,23,20
0,2302777648,2009-06-23 20:16:53,TheRealMora,Pre paid phone runs out of minutes after today,2009,6,23,20
0,2302813948,2009-06-23 20:19:56,joaopsmartins,Recebendo updates pelo twitter tmn pt e enviando pelo tweetaporsms com ficam me a 6 c ntimos cada SMS tweet not cool,2009,6,23,20
0,2302829201,2009-06-23 20:21:11,gustavschafer,don t feel bad i only said people follow lizzischerf cos she was one of the first people to speak 2 me properly on twitter,2009,6,23,20
0,2302927312,2009-06-23 20:29:24,SpunkeyMama,Lost my mother ring Just bought it a few months ago,2009,6,23,20
0,2303165711,2009-06-23 20:49:12,Jaedavinci,yeah,2009,6,23,20
0,2303168255,2009-06-23 20:49:25,GreenGardenChic,link doesn t open for me,2009,6,23,20
0,2303185329,2009-06-23 20:50:49,sputniksrevenge,chloecs refusing force feeding now going to call vet tomarro we think she is telling us its time,2009,6,23,20
0,2306034305,2009-06-24 00:41:06,PamonSunset,You give me fever isn t quite so romantic when its literal,2009,6,24,0
0,2306752401,2009-06-24 01:55:12,MsAwesome_Piink,I m so tired So so tired,2009,6,24,1
0,2321356035,2009-06-24 23:56:32,rawrmaddierawr,Bye bye guys I m leaving tomorrow,2009,6,24,23
0,2321413355,2009-06-25 00:01:18,Jasmine_Tafoya,why couldnt you have said brown,2009,6,25,0
