target,id,date,user,text,year,month,day,hour
0,1985834168,2009-05-31 20:51:37,Puppetguy,Still no luck finding the hat,2009,5,31,20
0,1985905969,2009-05-31 21:00:00,BrookeAmanda,Really craving Starbuck s coffee right now Why does the closest one have to be 3 hours away,2009,5,31,21
0,1986024338,2009-05-31 21:12:07,Godmutha43,Woo Hoo Can t believe we have to wait another year though,2009,5,31,21
0,1986102553,2009-05-31 21:19:37,lys47,sunburnt but thats okay cuz today was AMAZING cuz i got to spend with an awesome guy really missing him right now,2009,5,31,21
0,1986208081,2009-05-31 21:29:36,thesexypanther,guess im goin to sleep,2009,5,31,21
0,1986436827,2009-05-31 21:50:04,Monica_Star90,wow that was hecka wierd poor eminem he looked hecka pissed off,2009,5,31,21
0,1986491646,2009-05-31 21:54:32,linfinity27,I hate the ASPCA commercials they make me soo sad,2009,5,31,21
0,1986492670,2009-05-31 21:54:38,Summerluvsblock,Will u guys please tell us if u r going to reschedule the shows really hard to see ur posts not knowing if we get to c the shows,2009,5,31,21
0,1986514463,2009-05-31 21:56:31,cdove85,cant sleep im so scared of tomorrow,2009,5,31,21
0,1986585966,2009-05-31 22:02:23,vixgirl,Leaving today and very sad about it Big romantic airport farewells are all very well but still lots,2009,5,31,22
0,1986613237,2009-05-31 22:04:42,haydizle,wishes he had a job its so boring,2009,5,31,22
0,1986661082,2009-05-31 22:08:52,julielineberry,I want to go see Up,2009,5,31,22
0,1986662268,2009-05-31 22:08:57,struhar2009,wish paramore had won,2009,5,31,22
0,1986854458,2009-05-31 22:24:46,Miss_LeAnn,im looking for Mr Yeah so far no damn luck lol,2009,5,31,22
0,1986894983,2009-05-31 22:28:33,_crackfox,I need to sleep SO BADLY that it isn t even funny but I can t Having such a detrimental effect on my health,2009,5,31,22
0,1986895327,2009-05-31 22:28:35,Shanell_Renae,but i wouldnt have it any other way you hair is beautiful dont cut it,2009,5,31,22
0,1988686359,2009-06-01 02:05:03,Halcyon_Dtier,Stupid leg is being a bit weird If this keeps up I ll have to go back on injections I guess,2009,6,1,2
0,1988800063,2009-06-01 02:24:40,LAMBEYgoneWILD,EVERYONE IS BEING SO MEAN 2ME 2NIGHT,2009,6,1,2
0,1988924328,2009-06-01 02:47:08,11chiqa11,Cried at the last day of school today I ll miss all those teachers who got outta school,2009,6,1,2
0,1988961795,2009-06-01 02:54:21,pato_30stm,awww is there any lucky guy you know what i mean lol,2009,6,1,2
0,1988972121,2009-06-01 02:56:23,sarahdids,is wanting to be out in the sun again today not stuck in work,2009,6,1,2
0,1989015676,2009-06-01 03:04:24,enliytenme,I m tired but I can t and don t wanna go 2 sleep,2009,6,1,3
0,1989039947,2009-06-01 03:09:02,Gopher194,My son Tom was transferred back from intensive care to reanimation,2009,6,1,3
0,1989082366,2009-06-01 03:17:15,JessMcFlyxxx,Eurgh cant be bothered with college today weathers too nice and im just not in the mood,2009,6,1,3
0,1989148090,2009-06-01 03:30:22,Trishanson,Aww UP was the cutest movie ever sooooo sad though,2009,6,1,3
0,1989155705,2009-06-01 03:31:55,iawa,On way to work wishing there was one more day to frolic in the sun Or more oh well willl have to wait till rainy next weekend,2009,6,1,3
0,1989203361,2009-06-01 03:42:00,katementon,arghh and now he s ruining in,2009,6,1,3
0,1989209041,2009-06-01 03:43:14,heyraefriday,has fully forgiven you and is really sorry i wish you d come back,2009,6,1,3
0,1989280718,2009-06-01 03:58:51,beautybeauty41,Albuquerque is a beautiful quirky mountain of loneliness Too bad I do not delight in isolation anymore,2009,6,1,3
0,1989315576,2009-06-01 04:05:37,panique,that is disgusting and sad,2009,6,1,4
0,1989343883,2009-06-01 04:11:39,SkyeeCaitlin,my trackball on my phone is broken again tear,2009,6,1,4
0,1989366168,2009-06-01 04:16:31,PrincessSakura,Not good to be back,2009,6,1,4
0,1989379945,2009-06-01 04:19:33,pjkix,Damn Hdmi cable didn t fix my Xbox red ring problem must be video related tho,2009,6,1,4
0,1989404269,2009-06-01 04:24:57,goatgirl74,can t make Glastonbury as in term time Going to Hard Rock Calling in Hyde Park on Sat 27th June You guys around,2009,6,1,4
0,1989549492,2009-06-01 04:57:28,oceanphoenix,Ai xem DVD Unlimited Symphony ch a,2009,6,1,4
0,1989623570,2009-06-01 05:12:53,DonnaKel,Another beautiful day Too nice to be stuck inside working,2009,6,1,5
0,1989708119,2009-06-01 05:31:29,kylkylmccl,Food poisoned by red robin,2009,6,1,5
0,1989742689,2009-06-01 05:39:01,DominaCaffeine,I m afraid has left the building you will have to make your own,2009,6,1,5
0,1989752228,2009-06-01 05:41:02,Sasha_xx,Im good Hows you At college atm x,2009,6,1,5
0,1989804940,2009-06-01 05:52:16,eleanorpigeon,trying to do my art essay i hate art,2009,6,1,5
0,1989821825,2009-06-01 05:56:02,felinefrenzee,gunna go nuts waiting for season 5 of supernatural doesnt start until september,2009,6,1,5
0,1989872072,2009-06-01 06:06:12,cille07,sooo craving for some wine amp pizza dayum this 2 week plan,2009,6,1,6
0,1989910141,2009-06-01 06:14:17,Joshyxspicenz,looka me oh wait u cant lol i have no face,2009,6,1,6
0,1989933741,2009-06-01 06:19:11,beePencil,Email playing up again freedom2surf need to sort this out quickly it s beginning to get irritating,2009,6,1,6
0,1989958015,2009-06-01 06:24:16,electricnet,My internet connection is seriously suffering What s a geek to do,2009,6,1,6
0,1990038993,2009-06-01 06:40:34,robstuhnahh,I ve been soo emoo WTF I want my old self back,2009,6,1,6
0,1990039364,2009-06-01 06:40:39,Speedu,Personne ne commente ma formidable review de Knight Rider,2009,6,1,6
0,1990045740,2009-06-01 06:41:56,tepar,Away from the internet and back to work,2009,6,1,6
0,1990093601,2009-06-01 06:51:30,xFenderChickx,Hello it s Kelly wwish me luck on the exit exam,2009,6,1,6
0,1990096749,2009-06-01 06:52:08,_Ser,so sad my aero spree is cancelled,2009,6,1,6
0,1990113437,2009-06-01 06:55:26,janepau13,Is there such a thing called dinner in bed I want one right now,2009,6,1,6
0,1990120690,2009-06-01 06:56:51,ChelsiieVegas,Millvina Dean the last survivor of the Titanic has died at the age of 97 so sad,2009,6,1,6
0,1990125025,2009-06-01 06:57:40,ggimmickgirl,I just spent 30 cabbing to Sembawang Shopping Center to fetch Z from work I expect a GIANT HUG from you ah annoying boy,2009,6,1,6
0,1990146049,2009-06-01 07:01:21,wowlew,isPlayer Has Died Sorry,2009,6,1,7
0,1990161251,2009-06-01 07:04:08,couturecandy,Bracing self for looming sodomy that is company law,2009,6,1,7
0,1990202697,2009-06-01 07:11:39,joshwhite101,oh no it won t stay like this i think its supposed to rain at some point this week,2009,6,1,7
0,1990260982,2009-06-01 07:22:01,MissanRy,is Leaving on a Jet Plane soooo sad,2009,6,1,7
0,1990283809,2009-06-01 07:26:06,Hend_xo,wants to get on ym msn,2009,6,1,7
0,1990331618,2009-06-01 07:34:23,scorpfromhell,use the DD facility if u hv in ur online banking net4 is ironically not so connected w banks for online payments,2009,6,1,7
0,1990387336,2009-06-01 07:43:57,Missscribbler,I m looking through some properties in this place called Hartamas Malaysia God I wish I have enough money I d have a great design,2009,6,1,7
0,1990470534,2009-06-01 07:57:34,Megan_B_,Now I remember what I don t like about winter Damn flu,2009,6,1,7
0,1990473259,2009-06-01 07:58:00,jonasliu,This is bad Roger is two sets down,2009,6,1,7
0,1990480703,2009-06-01 07:59:12,Liverpoolu,Watching the news this morning and thinking if we had a moments silence 4 all the worlds violence the world would b a quiet place,2009,6,1,7
0,1990543714,2009-06-01 08:08:43,2manycold1s,About to give up,2009,6,1,8
0,1990569423,2009-06-01 08:12:42,leaisonfiyerrr,Photo iattackfood I want this jacket Seriously Kahit yung fake sa Greenhills,2009,6,1,8
0,1990596581,2009-06-01 08:16:54,Avylina,sigh hit on harrrrd this morning at store and followed to parking lot I need a huge stick on wart for my forehead,2009,6,1,8
0,1990614667,2009-06-01 08:19:42,K30_,Ugh religion and literature finals but only 2 hours of school Hahahahaha,2009,6,1,8
0,1990623692,2009-06-01 08:21:01,MegPeddy,Back to work But it s only a 3 day week for me Hooray for weddings and Nashville,2009,6,1,8
0,1990637611,2009-06-01 08:23:09,MonteCito,quot The Coefficient of Determination quot Off istatistik seni sevmiyorum,2009,6,1,8
0,1990708023,2009-06-01 08:33:18,budgebandit,at work,2009,6,1,8
0,1990714254,2009-06-01 08:34:12,KlubKelli,Why oh why am I up so early Blah,2009,6,1,8
0,1990759271,2009-06-01 08:40:36,coconut111,I feel so bad for the people on the air france flight that quot dissapeared quot this morning over the Atlantic,2009,6,1,8
0,1990763601,2009-06-01 08:41:12,pixelseventy2,Ta Worst thing is it s just before the weekend So not much time off work,2009,6,1,8
0,1990804219,2009-06-01 08:46:53,K4LYN1SR4DD,Neither do I It was so weird this morning in the cafeteria It was so empty,2009,6,1,8
0,1990820380,2009-06-01 08:49:07,lovetease,I know I am almost finished,2009,6,1,8
0,1990994462,2009-06-01 09:11:21,twilkcom,Yup lots of people are having twitter background problems It s been happening for the last week or so,2009,6,1,9
0,1991065331,2009-06-01 09:20:02,daemonn,having issues with this broadcast research project oomph,2009,6,1,9
0,1991106768,2009-06-01 09:24:58,tyaswindya,not delicious body,2009,6,1,9
0,1991140066,2009-06-01 09:28:54,riaaaramos,feels sick again,2009,6,1,9
0,1991156772,2009-06-01 09:30:45,SueTab,Sad day,2009,6,1,9
0,1991171625,2009-06-01 09:32:25,deeeee,Heading to school,2009,6,1,9
0,1991275583,2009-06-01 09:44:21,elenarr,I want to sleep but I can t because I slept like all day in the car today I m gonna be tired tomorrow,2009,6,1,9
0,1991355460,2009-06-01 09:53:19,ThatAprilGirl,he has a hamstring injury Might not be able to play 4 da RPTeam in SEABA He ll be fine soon Ayw lang dw tlga xang irisk,2009,6,1,9
0,1991394951,2009-06-01 09:57:46,rachhhiee,I hate waking up for school,2009,6,1,9
0,1991395950,2009-06-01 09:57:52,AjaDev,mondays suck witout GG amp OTH this motrin dosnt seem 2 wanna work even worse i gotta go 2 the doctors again 2day boo,2009,6,1,9
0,1991443828,2009-06-01 10:02:58,RuyaBuyuktetik,wishin the best for the people in the plane i ll be headin to the airport to catch my own flight wish me luck,2009,6,1,10
0,1991621675,2009-06-01 10:22:14,Gwathiell,is back in Bratislava and loads of stuff in front of her And they gonna cancel our booooaaat trip Vltavaaaaaa,2009,6,1,10
0,1991624780,2009-06-01 10:22:34,trackno14,Can t wait to get back to work Spent the long weekend moping over what I m missing on the other side of the world amp failing to revise,2009,6,1,10
0,1991663439,2009-06-01 10:26:43,its_me_betty,ummm work work work work amp did I say work,2009,6,1,10
0,1991700433,2009-06-01 10:30:37,Serene_Balance,228 Souls on Board Air France Lost at Sea,2009,6,1,10
0,1991728701,2009-06-01 10:33:36,xMillerTime12x,ughhh i need to lose at least 15 pounds in less than 3 months fml,2009,6,1,10
0,1991751427,2009-06-01 10:36:03,sewdabee,My face almost doesn t hurt today I really hate this spring cold I couldn t even smell my lilacs But I m almost through,2009,6,1,10
0,1991792273,2009-06-01 10:40:21,hannahfaulkes,i am trying atm and im very bored THANKS im so happy they re off you alright anyway,2009,6,1,10
0,1991814861,2009-06-01 10:42:42,reneetay,is home alone huhuuu,2009,6,1,10
0,1991831709,2009-06-01 10:44:29,Sean2theO,unfortunatley not I m looking 4people that live outside South Africa 2talk about where they live have you ever been 2 SA,2009,6,1,10
0,1991886822,2009-06-01 10:50:15,its_Dani_x,BORED been prevising with rach bu she had to go to work wish the swing chain was in the sun BOO DAD,2009,6,1,10
0,1991947368,2009-06-01 10:56:33,yummychocolate1,hey my sis and i are such huge fans especially my sis she tried sending a video to icarly com but it couldn t load,2009,6,1,10
0,1992030479,2009-06-01 11:04:53,Summy_Sums,Getting ready to leave Again it gets harder every weekend,2009,6,1,11
0,1992120091,2009-06-01 11:13:58,Managydja,Worried about the missing flight,2009,6,1,11
0,1992148762,2009-06-01 11:16:59,flowermonkey,Danny la rue has died another person i though would live forever,2009,6,1,11
0,1992167499,2009-06-01 11:18:55,felicityfuller,only 15 mins to go thank heavens it really has been one of those days where I think i have been going backwards,2009,6,1,11
0,1992198712,2009-06-01 11:21:53,rebeccawilsonx,i m burnt too my legs shoulders and arms haha xxx,2009,6,1,11
0,1992392072,2009-06-01 11:40:43,HeLetMeRideIt93,Just found out my pastor s leaving the church He will be missed,2009,6,1,11
0,1992466284,2009-06-01 11:47:59,drytears26,Blah hate mondays school s boring have to get back to school in 20 minutes and go to french blah,2009,6,1,11
0,1992517759,2009-06-01 11:52:58,GSpotspoon,oh I wish jus heard great stuff about it,2009,6,1,11
0,1992537856,2009-06-01 11:54:58,SusieKeen,missed live on cnn damn,2009,6,1,11
0,1992577251,2009-06-01 11:58:54,charmedmom611,Mafia Wars it is but can some people play fair i haven t robbed or deliberately attacked anyone but this TOAD guy s harassing me,2009,6,1,11
0,1992578062,2009-06-01 11:58:59,norarosee,Green milk tea with boba I m going to miss ryanpack,2009,6,1,11
0,1992658296,2009-06-01 12:06:46,Rheakumar,I m not sick I m not sick wait I am,2009,6,1,12
0,1992687135,2009-06-01 12:09:37,BonesCrazy24,Yeah I get in but then it s so slow the page crashes,2009,6,1,12
0,1992718964,2009-06-01 12:12:40,4LaurenB,Can t effin focus Auditing charts sucks when you have a headache,2009,6,1,12
0,1992768270,2009-06-01 12:17:25,marshymiffy,i would be queuing outside the CD store right now till midnight just to get your album but im not in the US,2009,6,1,12
0,1992790843,2009-06-01 12:19:38,Betty_Bop,How come anytime i want to re tweet something and its over the 140 characteristics it wont allow me and the other person can That sux,2009,6,1,12
0,1992822415,2009-06-01 12:22:40,NDUBZFAN4EVA,kira i am so sorry i dint mean it i am a complete shitface,2009,6,1,12
0,1992968675,2009-06-01 12:37:01,predator314,I m glad ZeeJustin didn t win the 40K event Cheating bastard doesn t deserve it I was pulling for Raymer though,2009,6,1,12
0,1992988939,2009-06-01 12:39:04,prettyyella,Ughhh I gotta go buy these books for my summer school classes,2009,6,1,12
0,1993006905,2009-06-01 12:40:49,ashmitchell,Was it good We didn t get to watch it in the D I DVR d it only to see WDIV had an hour Stanley Cup special instead,2009,6,1,12
0,1993052724,2009-06-01 12:45:17,roninwolf,I think I just killed my iPhone,2009,6,1,12
0,1993099030,2009-06-01 12:49:50,evetteallman,about to go over to dans for jacket potatoes and scary films missing scottish people though xx,2009,6,1,12
0,1993121651,2009-06-01 12:52:01,Portiaaaa,I keep accidently reading MTV Movie Rewards results STOP IT It s not on here until tonight kay,2009,6,1,12
0,1993256282,2009-06-01 13:05:04,xxMichellex3,I don t want to present it,2009,6,1,13
0,1993388977,2009-06-01 13:17:50,doctoranonymous,Rough day today fb,2009,6,1,13
0,1993532079,2009-06-01 13:31:41,maryjaneisabel,it makes me a little sick i feel like giving up,2009,6,1,13
0,1993549802,2009-06-01 13:33:22,OhSunshine_,why,2009,6,1,13
0,1993554170,2009-06-01 13:33:47,testguy1960,Sigh Being tired and eating good food does not help to stay awake during presentations,2009,6,1,13
0,1993720078,2009-06-01 13:49:33,CorNEILiuZ,did u find out where to get hold of it from Wish I was watching it,2009,6,1,13
0,1993730591,2009-06-01 13:50:32,bachan114,I need to find a second job,2009,6,1,13
0,1993766829,2009-06-01 13:53:57,roswelluga,where is my girl i don t know,2009,6,1,13
0,1993902868,2009-06-01 14:06:27,amykayODT,ooh I love Chipotle wish there was one around here,2009,6,1,14
0,1994143285,2009-06-01 14:28:53,sixstorm,Wifey s promising job got shot down by a transfer teacher Not a great day for us,2009,6,1,14
0,1994155219,2009-06-01 14:30:03,jennitapanila,oh okay i found out not here,2009,6,1,14
0,1994302848,2009-06-01 14:43:40,timothyc1985aph,Not yet,2009,6,1,14
0,1994303996,2009-06-01 14:43:47,lhsstudent,Fml geomety final gosh I hate this class,2009,6,1,14
0,1994445822,2009-06-01 14:56:07,sarapear,It s just before 5am here and I m heading back to bed It s too cold to be getting up in the middle of the night for the baby,2009,6,1,14
0,1994624388,2009-06-01 15:12:33,tabithabarron,wishes the weather was more like it was in LV,2009,6,1,15
0,1994671739,2009-06-01 15:16:47,riggsbecca,Sent sara off time to get to work,2009,6,1,15
0,1994689720,2009-06-01 15:18:23,OOFTStuart,guessing you don t have a PS3 then i m rather upset about the whole situation,2009,6,1,15
0,1994713704,2009-06-01 15:20:34,ashuhlayyy,I wish I could afford a trip to austrailia my dream vacation,2009,6,1,15
0,1994841504,2009-06-01 15:32:33,sprinkles_,ii want to come down stupid 3 4hr train journeys,2009,6,1,15
0,1994870558,2009-06-01 15:35:17,superstarnish,Lookin for an apartment Cant find nothing in my budget,2009,6,1,15
0,1994946723,2009-06-01 15:42:33,MrsSgtA,In bed watching tv with Adam Babies are asleep Back to work in 1 week,2009,6,1,15
0,1994952385,2009-06-01 15:43:06,esv123,I had to disect a cow heart in science today I have never fealt more guilty that I had spaghetti and meatballs last night,2009,6,1,15
0,1995012914,2009-06-01 15:48:45,mitzibitz,Mine isn t showing up either,2009,6,1,15
0,1995064032,2009-06-01 15:53:35,Romeo_Alexander,mann I m going to bed at 9 tonight LOL,2009,6,1,15
0,1995085067,2009-06-01 15:55:37,shayneismelody,possibly the ugliest girl from my high school days just passed by me in the mall and screamed at the top of her lungs quot HEY SHAYNE quot,2009,6,1,15
0,1995120165,2009-06-01 15:59:01,ChesterPDexter,if you get any dm s from me i am sorry i do not seem to have control of my dms what a PITA this is,2009,6,1,15
0,1995122206,2009-06-01 15:59:12,silent_hill2,got a chance to IM Maeve she s in France I miss her,2009,6,1,15
0,1995124049,2009-06-01 15:59:23,allmadmoji,I wanna hug elmo How comes gets to hug elmo It s not fair The world is no fair,2009,6,1,15
0,1995190273,2009-06-01 16:05:35,lala_beth,wow really isnt my nite 2 nite is it,2009,6,1,16
0,1995697502,2009-06-01 16:54:20,brookiebabee,Going to Joshuas All we do is watch movies I rely on you to entertain me,2009,6,1,16
0,1995737232,2009-06-01 16:58:07,GeorgieDLUX,story of my life,2009,6,1,16
0,1995930254,2009-06-01 17:16:06,itsasamccormick,I lost three followers That blows,2009,6,1,17
0,1995947536,2009-06-01 17:17:43,IAmAlexSuavez,I know I m trying to find something to calm me down It s usually Elliot s face but rn I just idek D still crying D,2009,6,1,17
0,1995994936,2009-06-01 17:22:11,Sonj1,Trying 2 change my profile pic bt it won t let me,2009,6,1,17
0,1996004272,2009-06-01 17:23:04,mkcho73,well it s really messing me up,2009,6,1,17
0,1996056526,2009-06-01 17:28:02,XxSugarPlumXx,Oh My God Loved Hollyoaks Defo Very Emotional Shame Your Leaving xx,2009,6,1,17
0,1996087502,2009-06-01 17:30:54,sew_cute,wth heart o matic is telling me my etsy username is invalid,2009,6,1,17
0,1996103355,2009-06-01 17:32:22,Satise01,wish i was watching it right now cant even watch the repeat cos the tv is being hogged D,2009,6,1,17
0,1996146455,2009-06-01 17:36:26,IvanaE,not fair i tweeting more and got blocked lol,2009,6,1,17
0,1996150121,2009-06-01 17:36:48,ginandphonics,I got mosbied a few weeks ago it s awkward city,2009,6,1,17
0,1996270775,2009-06-01 17:48:31,cosmostella,Bad bank bad practices bad man Does he even know whats going on,2009,6,1,17
0,1996334916,2009-06-01 17:54:50,dancer4life1091,unless mine comes before the 16th although you ll still get it first cuz I ll be in Disney World,2009,6,1,17
0,1996373077,2009-06-01 17:58:40,MiDesfileNegro,I keep checking but it hasn t arrived,2009,6,1,17
0,1996408795,2009-06-01 18:02:09,FrenchySteph,is preparing going back to work,2009,6,1,18
0,1996412807,2009-06-01 18:02:33,fixr,shame on me,2009,6,1,18
0,1996438288,2009-06-01 18:05:03,suchitawills,i can t wait until november,2009,6,1,18
0,1996591782,2009-06-01 18:20:44,ThomasShaped,Mine too I m dying,2009,6,1,18
0,1996594731,2009-06-01 18:21:03,grizzlypufff,off to bed now English in the morning oh joy My favourtie subject NOT night x,2009,6,1,18
0,1996612689,2009-06-01 18:22:57,TiffanyDoughty,tried to change it and it messed up,2009,6,1,18
0,1996780218,2009-06-01 18:40:41,Shannon_Kai,That was the least productive day I ve ever had at work not by choice,2009,6,1,18
0,1996891237,2009-06-01 18:52:43,TheTaxCoach,What s the chances of gas prices going down this weekend I m taking a road trip now I m up to 45 for a fill up,2009,6,1,18
0,1997154523,2009-06-01 19:21:00,savvygrl,hey I saw your tweet I hope everything is ok Ive had this happen to me twice if the friendship is genuine it will work out,2009,6,1,19
0,1997198893,2009-06-01 19:25:45,ljaesch,John came home from school this afternoon with a 101 degree fever,2009,6,1,19
0,1997207882,2009-06-01 19:26:42,TotemMedia,My prayers w families of passengers amp crew of AirFrance flight 447,2009,6,1,19
0,1997214079,2009-06-01 19:27:22,arepeejee,only sandwiches sadly,2009,6,1,19
0,1997227764,2009-06-01 19:28:50,flipsideoftcoin,oh that sounds awful Hope you get better soon So many people seem to be poorly right now not good,2009,6,1,19
0,1997235847,2009-06-01 19:29:41,galacticwoman,He s good Thanks for asking Me Im a lil under the weather,2009,6,1,19
0,1997237904,2009-06-01 19:29:54,GreaterWorks,normally I adore thunderstorms but not when they mess with my little girls birthday party,2009,6,1,19
0,1997262971,2009-06-01 19:32:26,Crystal_Said,oh sorry 36C i was cleaning the kitchen now im a my mother n laws house bout to eat dinner amp i forgot to make ur guac and pico,2009,6,1,19
0,1997265808,2009-06-01 19:32:45,xbr00talbrahx,doctors,2009,6,1,19
0,1997293974,2009-06-01 19:35:49,diradio,We had 2 000 a while ago but we lost a few followers,2009,6,1,19
0,1997376010,2009-06-01 19:44:30,LindaVig,i hear thunder and its getting darker im sure its on the way great,2009,6,1,19
0,1997419841,2009-06-01 19:49:06,glamjam,It s time for work to be over now I m going braindead I just want to go home and sleep in front of a fan,2009,6,1,19
0,1997422122,2009-06-01 19:49:20,yamstersg,1 sarcasm 2 it is usually my job,2009,6,1,19
0,1997427150,2009-06-01 19:49:52,xtinalouise,cznt sleep i cant bbelive how sore my foot is,2009,6,1,19
0,1997502503,2009-06-01 19:57:55,rodlie,good post on twitter liked the perspective just hoping to dialogue on it on your blog but can t leave comments why,2009,6,1,19
0,1997503113,2009-06-01 19:57:59,DRESINATRA,i hit u up earlier but u never hit me baaaack plus last night i crashed out after exhausthion over the week,2009,6,1,19
0,1997552326,2009-06-01 20:03:00,kaileycost,what a sad sad day i don t think i could ever break up with my bold,2009,6,1,20
0,1997562058,2009-06-01 20:03:59,leahfalkowski,ahhh WaWa I miss WaWa I could go for some Diet Lemonade Tea right now,2009,6,1,20
0,1997693506,2009-06-01 20:17:40,reverieBR,Is driving back home Wants to talk to someone on the phone,2009,6,1,20
0,1997811070,2009-06-01 20:29:55,ShandiPotter,thanks Trevor now I want Pizza Hut,2009,6,1,20
0,1997870329,2009-06-01 20:35:55,MissTam007,Nessa what are you crying for Don t cry,2009,6,1,20
0,1997880951,2009-06-01 20:37:03,samanthuggg,i wish i was with and but no i have to study,2009,6,1,20
0,1997891588,2009-06-01 20:38:12,deven11,going to the drive in tonight,2009,6,1,20
0,1997949294,2009-06-01 20:44:13,KelleyTwit,Oh no Student council speeches in front of the whole school tomorrow Oh gosh I have so much homework today,2009,6,1,20
0,1998039745,2009-06-01 20:53:28,satori,such a stupid thing to do I wasn t paying attention Good thing we were making aspirin today Didn t have it in me to take it hah,2009,6,1,20
0,1998103144,2009-06-01 20:59:58,thecaitlin,This bathroom smells like a litter box,2009,6,1,20
0,1998215338,2009-06-01 21:11:00,leighalexander,oops i have been forgetting to e3 tag all my E3 tweets,2009,6,1,21
0,1998216107,2009-06-01 21:11:05,lydia_eve,why won t twitter change my effin picture ARRGHHH,2009,6,1,21
0,1998244251,2009-06-01 21:13:54,MisssVix,read it on my blackberry babe I understand your pain sure there isnt some way you can make it to one of the shows,2009,6,1,21
0,1998724963,2009-06-01 22:01:24,ms_sugakane,FYI guys stop taking pics with your face in your chin,2009,6,1,22
0,1998737483,2009-06-01 22:02:37,bina13,my dad is a ROCKSTAR he surprised me today with my 2nd guitar my 1st is a very sad story my bro sold it wen i was 9 didnt get to use it,2009,6,1,22
0,1998739046,2009-06-01 22:02:46,Brennn,Boo,2009,6,1,22
0,1998754628,2009-06-01 22:04:16,crashdance,spicy dragon is soo good but makes me feel like crap after,2009,6,1,22
0,1998758923,2009-06-01 22:04:42,jstnhpkns,They brought me a sofa So now I can get some real sleep right,2009,6,1,22
0,1998797122,2009-06-01 22:08:24,LolzyluvsJB,OMJ That Air France Thing Is Really Sad,2009,6,1,22
0,1998797417,2009-06-01 22:08:26,mobilesydney,Ughhhh our routers been acting up since my laptop came back We can t find the cd to reinstall it Crap Ugh,2009,6,1,22
0,1998988850,2009-06-01 22:27:24,jerseymoongirl,I hate to tell u this but being outside could be aggravating your allergies its BAD allergy season,2009,6,1,22
0,1999057487,2009-06-01 22:34:10,chrssytna,I knooow It completely breaks my heart,2009,6,1,22
0,1999074091,2009-06-01 22:35:52,hambl3,still no word i ll be stuck here forever,2009,6,1,22
0,1999234178,2009-06-01 22:52:13,needaisy,Everyone s statuses are about Kim amp Jacob Sometimes being from a small town can be so tragic Praying hard,2009,6,1,22
0,1999364113,2009-06-01 23:05:26,ephaw,Kinda sad to know that won t be on the show tonight,2009,6,1,23
0,1999510653,2009-06-01 23:20:40,missyosigirl,feels bad but i m hoping i won t feel worse,2009,6,1,23
0,1999565505,2009-06-01 23:26:28,pseudonyms,i m coming july 6 7 for orientation that s all just two days BUT i move to chicago AUG 29 COME VISIT obvs,2009,6,1,23
